{
  "$schema": "https://json-schema.org/draft/2020-12/schema",
  "$id": "urn:kip:2.0:schema:schema-package",
  "type": "object",
  "properties": {
    "format": {
      "const": "KIP-Schema-Package"
    },
    "format_version": {
      "const": "2.0-draft"
    },
    "manifest": {
      "type": "object",
      "properties": {
        "package_id": {
          "type": "string",
          "minLength": 1
        },
        "version": {
          "type": "string",
          "minLength": 1
        },
        "package_ref": {
          "type": "string",
          "minLength": 1
        },
        "validation_schemas": {
          "type": "array",
          "items": {
            "type": "object",
            "properties": {
              "id": {
                "type": "string",
                "minLength": 1
              },
              "content_digest": {
                "type": "string",
                "minLength": 1,
                "pattern": "^sha256:[0-9a-f]{64}$"
              }
            },
            "required": [
              "id",
              "content_digest"
            ],
            "additionalProperties": false
          }
        }
      },
      "required": [
        "package_id",
        "version",
        "package_ref"
      ],
      "additionalProperties": true
    },
    "dependencies": {
      "type": "array",
      "items": {
        "type": "object"
      }
    },
    "definitions": {
      "type": "object",
      "properties": {
        "concept_types": {
          "type": "object",
          "additionalProperties": {
            "type": "object",
            "properties": {
              "ref": {
                "type": "string",
                "minLength": 1
              },
              "kind": {
                "const": "ConceptType"
              },
              "description": {
                "type": "string"
              },
              "fields": {
                "$ref": "#/$defs/FieldDefinitions"
              },
              "attributes": {
                "$ref": "#/$defs/AttributesDefinition"
              },
              "value_schema": {
                "type": "object"
              },
              "reference_paths": {
                "type": "array",
                "items": {
                  "$ref": "#/$defs/ReferencePath"
                }
              },
              "computed": {
                "type": "boolean",
                "description": "Engine-derived, read-only member (Spec §18.2): never written, never a version plane, never exported as state."
              }
            },
            "required": [
              "ref",
              "kind"
            ],
            "additionalProperties": true
          }
        },
        "predicates": {
          "type": "object",
          "additionalProperties": {
            "type": "object",
            "properties": {
              "ref": {
                "type": "string",
                "minLength": 1
              },
              "kind": {
                "const": "PredicateType"
              },
              "description": {
                "type": "string"
              },
              "subject": {
                "type": "object"
              },
              "object": {
                "type": "object"
              },
              "functional": {
                "type": "boolean"
              },
              "functional_by": {
                "enum": [
                  "object_type"
                ],
                "description": "Functional within each partition of candidate objects sharing a Concept Type lineage (Spec §20.15)."
              },
              "open_world": {
                "type": "boolean"
              },
              "complete": {
                "type": "boolean"
              },
              "boolean_completeness": {
                "type": "boolean"
              },
              "temporal_conflict": {
                "enum": [
                  "overlapping_valid_time",
                  "none"
                ]
              }
            },
            "required": [
              "ref",
              "kind"
            ],
            "additionalProperties": true,
            "allOf": [
              {
                "not": {
                  "required": [
                    "functional",
                    "functional_by"
                  ],
                  "properties": {
                    "functional": {
                      "const": true
                    }
                  }
                }
              },
              {
                "if": {
                  "required": [
                    "functional_by"
                  ]
                },
                "then": {
                  "required": [
                    "object"
                  ],
                  "properties": {
                    "object": {
                      "not": {
                        "required": [
                          "literal_types"
                        ]
                      },
                      "anyOf": [
                        {
                          "required": [
                            "concept_types"
                          ]
                        },
                        {
                          "required": [
                            "kinds"
                          ],
                          "properties": {
                            "kinds": {
                              "contains": {
                                "const": "Concept"
                              }
                            }
                          }
                        }
                      ]
                    }
                  }
                },
                "$comment": "functional_by partitions by the object's Concept Type, so the object target must admit Concepts and never Literal values (Spec §20.15)."
              }
            ]
          }
        },
        "facets": {
          "type": "object",
          "additionalProperties": {
            "type": "object",
            "properties": {
              "ref": {
                "type": "string",
                "minLength": 1
              },
              "kind": {
                "const": "FacetDefinition"
              },
              "description": {
                "type": "string"
              },
              "fields": {
                "$ref": "#/$defs/FieldDefinitions"
              },
              "attributes": {
                "$ref": "#/$defs/AttributesDefinition"
              },
              "value_schema": {
                "type": "object"
              },
              "reference_paths": {
                "type": "array",
                "items": {
                  "$ref": "#/$defs/ReferencePath"
                }
              },
              "computed": {
                "type": "boolean",
                "description": "Engine-derived, read-only member (Spec §18.2): never written, never a version plane, never exported as state."
              }
            },
            "required": [
              "ref",
              "kind"
            ],
            "additionalProperties": true
          }
        },
        "structural_fields": {
          "type": "object",
          "additionalProperties": {
            "type": "object",
            "properties": {
              "ref": {
                "type": "string",
                "minLength": 1
              },
              "kind": {
                "const": "StructuralFieldDefinition"
              },
              "description": {
                "type": "string"
              },
              "source": {
                "type": "object"
              },
              "target": {
                "type": "object"
              },
              "cardinality": {
                "type": "object"
              },
              "ordered": {
                "type": "boolean"
              },
              "unique": {
                "type": "boolean"
              },
              "computed": {
                "type": "boolean",
                "description": "Engine-derived, read-only member (Spec §18.2): never written, never a version plane, never exported as state."
              }
            },
            "required": [
              "ref",
              "kind"
            ],
            "additionalProperties": true
          }
        }
      },
      "required": [],
      "additionalProperties": true
    },
    "constraints": {
      "type": "array",
      "items": {
        "type": "object"
      }
    },
    "aliases": {
      "type": "object"
    },
    "compatibility": {
      "type": "object"
    },
    "migrations": {
      "type": "array",
      "items": {}
    },
    "model_hints": {
      "type": "object"
    },
    "canonicalization": {
      "type": "object"
    },
    "integrity": {
      "type": "object",
      "properties": {
        "digest_profile": {
          "const": "kip-jcs-safe-v1"
        },
        "content_digest": {
          "type": "string",
          "minLength": 1,
          "pattern": "^sha256:[0-9a-f]{64}$"
        },
        "covers": {
          "type": "string",
          "minLength": 1
        },
        "signatures": {
          "type": "array",
          "items": {
            "type": "object"
          }
        }
      },
      "required": [
        "digest_profile",
        "content_digest"
      ],
      "additionalProperties": false
    }
  },
  "required": [
    "format",
    "format_version",
    "manifest",
    "definitions",
    "integrity"
  ],
  "additionalProperties": false,
  "$defs": {
    "FieldDefinitions": {
      "type": "object",
      "additionalProperties": {
        "type": "object",
        "properties": {
          "type": {
            "anyOf": [
              {
                "type": "string",
                "minLength": 1
              },
              {
                "type": "array",
                "items": {
                  "type": "string",
                  "minLength": 1
                }
              }
            ]
          },
          "required": {
            "type": "boolean"
          },
          "mutable": {
            "type": "boolean"
          },
          "value_schema": {
            "type": "object"
          }
        },
        "required": [
          "type"
        ],
        "additionalProperties": true
      }
    },
    "AttributesDefinition": {
      "type": "object",
      "properties": {
        "open": {
          "type": "boolean"
        },
        "fields": {
          "$ref": "#/$defs/FieldDefinitions"
        },
        "value_schema": {
          "type": "object"
        }
      },
      "required": [
        "fields"
      ],
      "additionalProperties": false
    },
    "ReferencePath": {
      "type": "object",
      "properties": {
        "path": {
          "type": "string",
          "pattern": "^/"
        },
        "target": {
          "const": "element"
        },
        "namespace": {
          "const": "source"
        }
      },
      "required": [
        "path",
        "target",
        "namespace"
      ],
      "additionalProperties": false
    }
  }
}
